{
  "schema_version": "1.0",
  "skill": "idea-to-content",
  "status": "ready",
  "title": "Capture the idea before it disappears",
  "summary": "Three hooks, a short video script, and two companion posts about keeping a useful content idea inbox.",
  "assumptions": [
    "The intended audience is new creators juggling content with other work.",
    "No platform or commercial offer was specified, so the drafts are platform-neutral and invite a practical action."
  ],
  "questions": [],
  "limitations": [],
  "data": {
    "brief": {
      "source_idea": "User note: I keep forgetting content ideas when I am out. I want to show people a simple idea inbox using phone notes: idea, who it helps, one concrete example.",
      "audience": "New creators who capture ideas between other commitments",
      "goal": "Help viewers save an idea with enough context to develop it later",
      "tone": "Primary style: Engaging; secondary style: Educational; energy: Balanced; wording: Conversational; practical and specific",
      "platforms": [
        "platform-neutral"
      ]
    },
    "selected_angle": {
      "title": "Save the context, not just the topic",
      "takeaway": "Capture an idea, the person it helps, and one example while they are still clear.",
      "reason": "The user's three-field inbox supplies a small action viewers can try immediately."
    },
    "hooks": [
      {
        "id": "hook-1",
        "text": "Ever opened a note that says 'content planning' and thought, 'What was I going to say?'"
      },
      {
        "id": "hook-2",
        "text": "Future you needs more than a two-word note."
      },
      {
        "id": "hook-3",
        "text": "Here's what I'd save instead of 'make a productivity video.'"
      }
    ],
    "assets": [
      {
        "id": "asset-1",
        "platform": "platform-neutral",
        "format": "video_script",
        "title": "A three-line idea inbox",
        "hook_id": "hook-1",
        "content": "Ever opened a note that says 'content planning' and thought, 'What was I going to say?'\n\nI keep forgetting content ideas when I'm out. So here's the phone-note version I'd use to hang on to the actual thought.\n\nThree lines: the idea, who it helps, and one example.\n\nSay the idea is a phone-note inbox. Who's it for? New creators thinking of posts between work and the commute. What could you show? One note with those three lines filled in.\n\nThat's something to come back to. You've got the point, the person you're talking to, and an example to start with.\n\nNext time an idea hits, give future you all three lines.",
        "caption": "'What was I going to say?' Give future you a clue: the idea, who it's for, and one example.",
        "call_to_action": "Next time an idea hits, give future you all three lines.",
        "production_notes": [
          "Spoken length: roughly 110 words, or 45–55 seconds at 120–150 words per minute; check with a read-through.",
          "Record a simple talking-head shot and optionally show the sample phone note; hide unrelated personal notes.",
          "Optional on-screen text: Idea / Who it helps / One example."
        ]
      },
      {
        "id": "asset-2",
        "platform": "platform-neutral",
        "format": "text_post",
        "title": "The note you can use later",
        "hook_id": "hook-2",
        "content": "Future you needs more than a two-word note.\n\nA tiny template for the next idea that shows up while you're out:\n\nIdea: I want to talk about ___.\nWho it helps: This is for someone who ___.\nExample: I could show them ___.\n\nThe last line is worth filling in. 'Content planning' can go in a dozen directions. One example gives you somewhere to start.\n\nCopy the three lines into a phone note for your next idea.",
        "caption": null,
        "call_to_action": "Copy the three lines into a phone note for your next idea.",
        "production_notes": []
      },
      {
        "id": "asset-3",
        "platform": "platform-neutral",
        "format": "text_post",
        "title": "Revisit an old idea",
        "hook_id": null,
        "content": "This note definitely made sense when you wrote it.\n\nNow it's just 'productivity video' staring back at you.\n\nBefore you try to turn it into a whole post, add the missing context: who it's for and one example you could show.\n\nIf the topic points to several different posts, choose the one with the clearest example. Leave the others in your inbox.\n\nOpen one old idea and finish this sentence: 'I could show this with…'",
        "caption": null,
        "call_to_action": "Open one old idea and finish this sentence: 'I could show this with…'",
        "production_notes": []
      }
    ],
    "review_notes": [
      "The personal statement about forgetting ideas comes from the user's note.",
      "The drafts make no measured productivity, revenue, or audience-growth claims."
    ]
  }
}
